{
  "membershipNumber": "C12345",
  "token": "HIDOSA",
  "arrival" : {
    "travelBy" : "Plane",
    "departureForUKDate": "2018-01-01",
    "departureForUKTime": "04:35",
    "portOfArrival": "London Heathrow",
    "portOfArrivalCode": "LHR",
    "arrivalTravel": "BK003",
    "arrivalDate" : "2015-11-26",
    "arrivalTime" : "21:45",
    "inwardDepartureCountry": "FRA",
    "inwardDeparturePort": "Paris",
    "inwardDeparturePortCode": "PSX",
    "flightDetailsCheck" : "No"
  },
  "departure" : {
    "knowDepartureDetails": "No",
    "ukDuration": "1 - 3 months"
  },
  "accommodation" : {
    "ukAddress" : [
      "UkAddress1",
      "UkAddress2",
      "UkAddress3",
      "UkAddress4",
      "Postcode"
    ],
    "ukVisitPhoneNumber": "0793487837429"
  }
}